commit	win_rate	avg_min_score	status	description
8062181	0.000000	0.0	crash	timeout/crash: baseline PPO
f3d3d8d	0.000000	0.1	discard	baseline PPO
8f4afc5	0.000000	0.0	crash	timeout/crash: baseline PPO
542bf82	0.000000	0.5	discard	baseline PPO
ace5961	0.000000	0.0	discard	+ROLLOUT_STEPS = 512       # steps per rollout before update +# Reward shaping +
3454747	0.000000	0.5	discard	+ENTROPY_COEF = 0.05       # entropy bonus coefficient — higher for exploration 
1bfc613	0.000000	0.0	discard	+ROLLOUT_STEPS = 512       # steps per rollout before update +# Reward shaping +
6d44e6b	0.000000	1.1	discard	baseline PPO
32df53a	0.120000	2.1	keep	+ROLLOUT_STEPS = 1024      # steps per rollout before update — larger for sparse
6003109	0.100000	2.2	discard	+ROLLOUT_STEPS = 2048      # steps per rollout before update — larger captures m
094672d	0.020000	0.5	discard	+LR_MIN = 3e-5               # minimum LR for cosine annealing schedule +    # C
87dd3ba	0.220000	20.0	keep	+SCORE_DELTA_COEF = 0.5    # weight on per-step score delta — boosted to dominat
3397827	0.020000	1.1	discard	+SCORE_AVG_WEIGHT = 0.0    # blend: 0=min-score only, 1=avg-score only — pure mi
f163745	0.280000	3.7	keep	+SCORE_DELTA_COEF = 1.5    # weight on per-step score delta — further boosted to
72b8631	0.140000	1.7	discard	+WIN_BONUS = 10.0          # extra reward added on terminal win — amplifies spar
9e0594f	0.240000	3.8	discard	+BOARD_CONV_CHANNELS = 64  # channels in board CNN — doubled for richer spatial 
a865d6a	0.080000	2.8	discard	+GAMMA = 0.999             # discount factor — increased for long-horizon game (
3988e61	0.020000	2.7	keep	baseline PPO
603ce68	0.000000	0.8	discard	+# Reward normalization +REWARD_NORM = True         # normalize rewards by runni
4f55fc2	0.040000	2.5	keep	+GAE_LAMBDA = 0.98         # GAE lambda — increased for long-horizon games to re
99cbde5	0.100000	2.3	keep	+GAE_LAMBDA = 0.95         # GAE lambda — reverted to standard; 0.98 degraded pe
2ca50e8	0.020000	3.0	discard	+SCORE_DELTA_COEF = 3.0    # weight on per-step score delta — doubled again to f
53c9183	0.140000	3.7	keep	+MINIBATCH_SIZE = 256      # minibatch size for PPO updates — larger batches sta
a6b15f1	0.020000	1.1	discard	+MINIBATCH_SIZE = 64       # minibatch size for PPO updates — restored to 64; 25
925a5e3	0.040000	2.6	discard	+ENTROPY_COEF = 0.03       # entropy bonus coefficient — increased to boost expl
fe40fb8	0.200000	7.2	keep	+PPO_EPOCHS = 4            # optimization epochs per rollout — halved to reduce
02a2c88	0.180000	4.6	discard	+LEARNING_RATE = 1e-4       # learning rate — reduced for more stable updates gi
9c0b66d	0.260000	6.2	keep	+HIDDEN_DIM = 256          # MLP hidden dimension — doubled to increase policy c
15879d6	0.160000	10.0	discard	+NUM_HIDDEN_LAYERS = 3     # number of hidden layers in MLP head — deeper policy
ea7034a	0.000000	2.2	discard	+VALUE_CLIP = True         # clip value function updates like policy — prevents
19fc248	0.160000	3.6	discard	+    optimizer = torch.optim.AdamW(model.parameters(), lr=LEARNING_RATE, weight_
fa0fff5	0.120000	6.5	discard	+            layers.append(nn.LayerNorm(HIDDEN_DIM))  # normalize activations —
7c9e94a	0.080000	5.1	discard	+CLIP_EPS = 0.3            # PPO clipping epsilon — loosened to allow larger pol
46de2b0	0.120000	3.2	discard	+            # Value loss — Huber is more robust to large reward-shaped return o
ea94326	0.100000	4.4	discard	+        self.conv3 = nn.Conv2d(out_channels, out_channels, kernel_size=3, paddi
3e689e5	0.140000	6.5	discard	+WARMUP_ROLLOUTS = 10      # linear LR warmup over first N rollouts — stabilizes
8d78327	0.060000	4.5	discard	+    # Per-minibatch advantage normalization — normalize within each minibatch f
25e6046	0.120000	3.7	discard	+            layers.append(nn.GELU())  # GELU activation — smoother gradients th
7cf9595	0.240000	6.9	discard	+VALUE_LR_MULTIPLIER = 3.0  # separate LR multiplier for critic — critic learns
3243a7e	0.200000	3.9	discard	+TARGET_KL = 0.01          # early stop PPO epochs when approx KL exceeds this —
d407997	0.100000	3.8	discard	+BOARD_CONV_CHANNELS = 64  # channels in board CNN — doubled; previous test was
bf20a8e	0.100000	3.5	discard	+NUM_HIDDEN_LAYERS = 2     # number of residual hidden layers in MLP head — each
853eaf8	0.240000	8.1	discard	+LR_FINAL = 1e-5           # final LR at end of training — linear decay from LEA
3e0badd	0.120000	3.8	discard	+SCORE_DELTA_COEF = 2.0    # weight on per-step score delta — tuned between 1.5
776959a	0.060000	3.6	discard	+REWARD_CLIP = 2.0         # clip shaped reward to [-REWARD_CLIP, REWARD_CLIP] —
c9e00ea	0.020000	0.8	discard	+NUM_ENVS = 4              # parallel environments — increases data diversity pe
96d5908	0.140000	3.5	discard	+ROLLOUT_STEPS = 2048      # steps per rollout before update — retrying with bet
2398d68	0.020000	1.4	keep	baseline PPO
067e840	0.020000	1.6	discard	+ +class RunningMeanStd: +    """Online running mean/variance for reward normali
5db241e	0.020000	1.0	discard	+PPO_EPOCHS = 8            # optimization epochs per rollout — doubled for more
b2fae18	0.000000	0.0	crash	timeout/crash: baseline PPO
a96b065	0.000000	0.0	crash	timeout/crash: +SYMMETRY_AUG = os.environ.get("SYMMETRY_AUG", "0") == "1"  # disabled — doubl
77d0ff2	0.000000	0.0	crash	timeout/crash: +CURRICULUM_HEURISTIC_END = float(os.environ.get("CURRICULUM_HEURISTIC_END", 0.7
976941b	0.140000	5.4	keep	+# RES_BLOCKS halved 6->3: recent baselines timed out at 5min budget. Halving +# (vs_pool=0.6458333333333334)
976941b	0.100000	6.4	keep	+# RES_BLOCKS halved 6->3: recent baselines timed out at 5min budget. Halving +# (vs_pool=0.75)
976941b	0.020000	3.1	discard	+# RES_BLOCKS halved 6->3: recent baselines timed out at 5min budget. Halving +# (vs_pool=0.5)
8e9aaad	0.000000	0.0	crash	timeout/crash: +MARGIN_DELTA_COEF = float(os.environ.get("MARGIN_DELTA_COEF", 2.0))  # boosted:
140657c	0.000000	0.0	crash	timeout/crash: +# Linear anneal from ENTROPY_COEF (start) to ENTROPY_COEF_FINAL (end of +# trai
80f5613	0.000000	0.0	crash	timeout/crash: +POTENTIAL_GAMMA_SHAPING_COEF = float(os.environ.get("POTENTIAL_GAMMA_SHAPING_CO
6364287	0.000000	0.0	crash	timeout/crash: +REPLAY_K = int(os.environ.get("REPLAY_K", 0))  # disabled: PPO update was 6× o
e8a94ca	0.000000	0.0	keep	baseline PPO (vs_pool=0.375)
